{
  "v": "gabp/1",
  "id": "550e8400-e29b-41d4-a716-446655440012",
  "type": "response",
  "result": {
    "tools": [
      {
        "name": "inventory/get",
        "title": "Get Inventory",
        "description": "Returns the current inventory contents",
        "inputSchema": {
          "type": "object",
          "properties": {
            "playerId": {
              "type": "string"
            }
          },
          "additionalProperties": false
        },
        "outputSchema": {
          "type": "object",
          "properties": {
            "slots": {
              "type": "array"
            }
          },
          "required": ["slots"],
          "additionalProperties": false
        }
      }
    ]
  }
}
